domain,registered_date,registered_year,expire,changed,registrar,org,city,country,nameservers
cidata.gob.ve,2025-11-04,2025,2035-11-04,2025-11-04,NIC-VE,Centro De Investigaciones De Astronomia Francisco J Duarte,5101,VE,"ns.nocdirect.com, ns2.nocdirect.com"
alcaldiadeguarenas.gob.ve,2025-11-03,2025,2035-11-03,2025-11-03,NIC-VE,Alcaldia Del Municipio Plaza,1220,VE,"ns1.centos-webpanel.com, ns2.centos-webpanel.com, ns3.centos-webpanel.com, ns4.centos-webpanel.com"
alcaldiaderoscio.gob.ve,2025-10-18,2025,2035-10-18,2025-10-18,NIC-VE,Alcaldia Del Municipio Autonomo Roscio,8001,VE,"ns7.globalhostla.com, ns8.globalhostla.com"
cronistadecaracas.gob.ve,2025-10-07,2025,2035-10-07,2025-10-07,NIC-VE,Organo Auxiliar Municipal Del Cronista Municipio Libertador,1010,VE,"ns3.nube.gob.ve, ns5.nube.gob.ve"
robertserra.gob.ve,2025-09-29,2025,2035-09-29,2025-09-29,NIC-VE,Fundacion Mision Jovenes De La Patria Robert Serra,1012,VE,"ns13.tepuyserver.net, ns14.tepuyserver.net"
sedatebne.gob.ve,2025-08-01,2025,2035-08-01,2025-08-01,NIC-VE,Superintendencia De Administraci  N Tributaria Del Estado Bolivariano De Nueva Esparta,6301,VE,dns.sedatebne.gob.ve
guayanaesequiba.gob.ve,2025-07-25,2025,2035-07-25,2025-07-25,NIC-VE,Gobernaci  N Del Estado Guayana Esequiba,1064,VE,"ns1.nube.gob.ve, ns2.nube.gob.ve"
sen.gob.ve,2025-06-10,2025,2035-06-10,2025-06-10,NIC-VE,Corporacion Electrica Nacional S  A   Corpoelec,1010,VE,"romina.ns.cloudflare.com, jonah.ns.cloudflare.com"
dgnb.gob.ve,2025-06-06,2025,2035-06-06,2025-06-06,NIC-VE,Direcci  N General Nacional De Bomberos,1050,VE,"ns2.fonbe.gob.ve, ns1.fonbe.gob.ve"
granmisionvueltaalapatria.gob.ve,2025-05-23,2025,2035-05-23,2025-05-23,NIC-VE,Instituto Autonomo Consejo Nacional De Derechos De Ni  Os  Ni  As Y Adolecentes  Idenna,1053,VE,"m2.servidoro.com, m1.servidoro.com"
mincoex.gob.ve,2025-04-04,2025,2035-04-04,2025-04-04,NIC-VE,Ministerio Del Poder Popular Para El Comercio Exterior,1060,VE,"ns2.galawebhost.net, ns1.galawebhost.net"
enpi.gob.ve,2025-03-17,2025,2035-03-17,2025-03-17,NIC-VE,Servicio Autonomo De La Propiedad Intelectual,1010,VE,"dns2.enpi.gob.ve, dns1.enpi.gob.ve"
comex.gob.ve,2025-03-14,2025,2035-03-14,2025-03-14,NIC-VE,Ministerio Del Poder Popular De Econom  A Y Finanzas,1010,VE,"dns2.mppef.gob.ve, dns1.mppef.gob.ve"
inpsaseletica.gob.ve,2025-03-13,2025,2035-03-13,2025-03-13,NIC-VE,"Inst. Nacional De Prevencion, Salud Y Seguridad Laborales",1030,VE,"dns2.cantv.net, dns1.cantv.net"
masciencia.gob.ve,2025-03-11,2025,2035-03-11,2025-03-11,NIC-VE,Parque Cientifico Tecnol  Gico De Venezuela M  S Ciencia  S A,1204,VE,"ns2.mppct.gob.ve, ns1.mppct.gob.ve"
circuitoscomunales.gob.ve,2025-02-13,2025,2035-02-13,2025-02-13,NIC-VE,Comision Nacional De Telecomunicaciones Conatel,1020,VE,"romina.ns.cloudflare.com, jonah.ns.cloudflare.com"
minhidrocarburos.gob.ve,2025-01-07,2025,2035-01-07,2025-01-07,NIC-VE,Ministerio Del Poder Popular De Petroleo,1050,VE,"dns2.cantv.net, dns1.cantv.net"
siarteccarabobo.gob.ve,2024-12-04,2024,2034-12-04,2024-12-04,NIC-VE,Gobernacion Estado Carabobo,2003,VE,"dns2.cantv.net, dns1.cantv.net"
minaamp.gob.ve,2024-10-14,2024,2034-10-14,2024-10-14,NIC-VE,Ministerio Del Poder Popular Para Los Adultos Y Adultas Mayores  Abuelos Y Abuelas De La Patria,1050,VE,"dns2.minaamp.gob.ve, dns1.minaamp.gob.ve"
procuraduriaestadobarinas.gob.ve,2024-10-01,2024,2034-10-01,2024-10-01,NIC-VE,Procuraduria General Del Estado Barinas,5201,VE,"ns4.netvicios.com, ns3.netvicios.com"
cpsa.gob.ve,2024-09-30,2024,2034-09-30,2024-09-30,NIC-VE,Conglomerado Productivo S A,1010,VE,"dns2.cantv.net, dns1.cantv.net"
contraloriadecarirubana.gob.ve,2024-09-03,2024,2034-09-03,2024-09-03,NIC-VE,Contraloria Municipal De Carirubana,4102,VE,"ns2.siteground.net, ns1.siteground.net"
consejolegislativolara.gob.ve,2024-06-07,2024,2034-06-07,2024-06-07,NIC-VE,Consejo Legislativo Del Estado Lara,3001,VE,"dns2004b.trouble-free.net, dns2004a.trouble-free.net"
alcaldiasancristobal.gob.ve,2024-05-29,2024,2034-05-29,2024-05-29,NIC-VE,Alcaldia Del Municipio San Cristobal,5001,VE,"ns2.uanesi.net, ns1.uanesi.net"
pciviltachira.gob.ve,2024-03-26,2024,2034-03-26,2024-03-26,NIC-VE,Instituto Autonomo De Proteccion Civil Del Estado Tachira,5001,VE,"ns2.dns-parking.com, ns1.dns-parking.com"
sbr.gob.ve,2024-03-18,2024,2034-03-18,2024-03-18,NIC-VE,Servicio De Bienes Recuperados,1060,VE,ns1.sbr.gob.ve
cenipa.gob.ve,2024-02-21,2024,2034-02-21,2024-02-21,NIC-VE,Centro Nacional De Investigacion De Pesca Y Agricultura,1015,VE,"dns2.cenipa.gob.ve, dns1.cenipa.gob.ve"
nuevaepoca.gob.ve,2024-02-21,2024,2034-02-21,2024-02-21,NIC-VE,Gobernacion Del Estado Bolivariano De Miranda,1201,VE,"ns4.daycohost.net, ns3.daycohost.net, ns2.daycohost.net, ns1.daycohost.net"
venezuelatoda.gob.ve,2023-11-08,2023,2033-11-08,2023-11-08,NIC-VE,Gobernacion Del Estado Bolivariano De Miranda,1201,VE,"ns2.daycohost.net, ns1.daycohost.net, ns3.daycohost.net, ns4.daycohost.net"
corpesca.gob.ve,2023-11-02,2023,2033-11-02,2023-11-02,NIC-VE,Corporacion De Servicios Pesqueros Y Acuicolas De Venezuela,1015,VE,"dns2.cantv.net, dns1.cantv.net"
comisionesequibo.gob.ve,2023-09-27,2023,2033-09-27,2023-09-27,NIC-VE,Compa  Ia Anonima Venezolana De Television,1071,VE,"dns2.cantv.net, dns1.cantv.net"
misionpiar.gob.ve,2023-09-15,2023,2033-09-15,2023-09-15,NIC-VE,Fundacion Mision Piar,1010,VE,"ns4.mppdme.gob.ve, ns3.mppdme.gob.ve"
alcaldiadelmunicipiotinaco.gob.ve,2023-08-21,2023,2033-08-21,2023-08-21,NIC-VE,Alcaldia Del Municipio Tinaco,2206,VE,"ns24.tepuyserver.net, ns23.tepuyserver.net"
hidrolago.gob.ve,2023-07-11,2023,2033-07-11,2023-07-11,NIC-VE,C A  Hidrologica Del Lago De Maracaibo,4004,VE,"dns2.cantv.net, dns1.cantv.net"
cnu.gob.ve,2023-06-15,2023,2033-06-15,2023-06-15,NIC-VE,Consejo Nacional De Universidades,1010,VE,"ns4.reacciun.ve, ns3.reacciun.ve"
concejolossalias.gob.ve,2023-06-08,2023,2033-06-08,2023-06-08,NIC-VE,Concejo Municipal Del Municipio Los Salias,1204,VE,"ns20.tepuyserver.net, ns19.tepuyserver.net"
fonaem.gob.ve,2023-05-23,2023,2033-05-23,2023-05-23,NIC-VE,Fondo Nacional Para Los Emprendimientos  S A,1010,VE,"dns2.planetahosting.pe, dns1.planetahosting.pe"
misionribas.gob.ve,2023-04-14,2023,2033-04-14,2023-04-14,NIC-VE,Fundación Misión Ribas,1041,VE,"ns4.reacciun.ve, ns3.reacciun.ve"
nube.gob.ve,2023-03-30,2023,2033-03-30,2025-03-05,NIC-VE,Corporacion Para El Desarrollo Cientifico Y Tecnologico  S A,1020,VE,"ns2.nube.gob.ve, ns1.nube.gob.ve, ns6.nube.gob.ve, ns5.nube.gob.ve, ns4.nube.gob.ve, ns3.nube.gob.ve"
femsur.gob.ve,2023-03-23,2023,2033-03-23,2023-03-23,NIC-VE,Fundacion Escuela Feminista Del Sur Argelia Laya Femsur,1010,VE,"dns2.femsur.gob.ve, dns1.femsur.gob.ve"
fasmee.gob.ve,2023-01-05,2023,2033-01-05,2023-01-05,NIC-VE,Fondo Autoadministrado De Salud Para El Ministerio Del Poder Popular Para La Energia Electrica,1060,VE,"fasdns02.fasmee.gob.ve, fasdns01.fasmee.gob.ve, fasdns03.fasmee.gob.ve, fasdns04.fasmee.gob.ve"
sigestel.gob.ve,2023-01-04,2023,2033-01-04,2023-01-04,NIC-VE,Comision Nacional De Telecomunicaciones Conatel,1020,VE,"owen.ns.cloudflare.com, luciane.ns.cloudflare.com"
comisionpresidencialucv.gob.ve,2022-12-16,2022,2032-12-16,2022-12-16,NIC-VE,Fundaci  N Misi  N Venezuela Bella,1010,VE,"ns2.siteground.net, ns1.siteground.net"
sabates.gob.ve,2022-12-16,2022,2032-12-16,2022-12-16,NIC-VE,Servicio Autonomo Bolivariano De Administracion Tributaria Del Estado Sucre  Sabates,6101,VE,"ns3.daycohost.com, ns4.daycohost.com"
parguaza.gob.ve,2022-10-28,2022,2032-10-28,2022-10-28,NIC-VE,Empresa Mixta Minera Ecosocialista Parguaza S A,8007,VE,"ns3.mppdme.gob.ve, ns4.mppdme.gob.ve"
cmbnaguanagua.gob.ve,2022-10-25,2022,2032-10-25,2022-10-25,NIC-VE,Concejo Municipal Bolivariano De Naguanagua,2005,VE,"ns24.tepuyserver.net, ns23.tepuyserver.net"
loteriadecaracas.gob.ve,2022-10-18,2022,2032-10-18,2022-10-18,NIC-VE,Loteria De Caracas,1020,VE,"luke.ns.cloudflare.com, dina.ns.cloudflare.com"
respaldocomunal.gob.ve,2022-08-23,2022,2032-08-23,2022-08-23,NIC-VE,Servicio Fondo Nacional Del Poder Popular,1010,VE,"ns2.safonapp.gob.ve, ns1.safonapp.gob.ve"
vsctes.gob.ve,2022-06-27,2022,2032-06-27,2022-07-01,NIC-VE,Ministerio Del Poder Popular Para Ciencia Y Tecnologia,1010,VE,"ns1.mppct.gob.ve, ns2.mppct.gob.ve"
alcaldiasanfrancisco.gob.ve,2022-06-08,2022,2032-06-08,2022-08-26,NIC-VE,Alcaldia Del Municipio San Francisco,4004,VE,"ruth.ns.cloudflare.com, ajay.ns.cloudflare.com"
emvepro.gob.ve,2022-05-27,2022,2032-05-27,2022-05-27,NIC-VE,Empresa De Distribucion De Productos E Insumos  Venezuela Productiva  C A,2115,VE,"ns1.emvepro.gob.ve, ns2.emvepro.gob.ve"
alcaldiadenaguanagua.gob.ve,2022-04-28,2022,2032-04-28,2022-04-28,NIC-VE,Fisco Municipal De Naguanagua,2005,VE,"yolanda.ns.cloudflare.com, lochlan.ns.cloudflare.com"
gobernaciondelzulia.gob.ve,2022-04-18,2022,2032-04-18,2022-04-18,NIC-VE,Gobernacion Del Estado Zulia,4001,VE,"dns2.gobernaciondelzulia.gob.ve, dns1.gobernaciondelzulia.gob.ve"
comunas.gob.ve,2022-03-10,2022,2032-03-10,2022-03-10,NIC-VE,Ministerio Del Poder Popular Para Las Comunas Y Los Movimientos Sociales,1050,VE,"dns2.comunas.gob.ve, dns1.comunas.gob.ve"
concejomunicipiolostaques.gob.ve,2022-02-14,2022,2032-02-14,2022-02-14,NIC-VE,Concejo Municipal Los Taques,4101,VE,"dns2.namecheaphosting.com, dns1.namecheaphosting.com"
1x10delbuengobierno.gob.ve,2022-01-18,2022,2032-01-18,2022-01-18,NIC-VE,Comision Nacional De Telecomunicaciones Conatel,1020,VE,"dahlia.ns.cloudflare.com, nile.ns.cloudflare.com"
juegosnacionales.gob.ve,2022-01-11,2022,2032-01-11,2022-01-11,NIC-VE,Instituto Nacional De Deportes,1020,VE,"ns4.reacciun.ve, ns3.reacciun.ve"
corselca.gob.ve,2021-12-01,2021,2031-12-01,2024-10-08,NIC-VE,Corporacion Socialista Del Sector Electrodomesticos  C A,1052,VE,"dns2.corselca.gob.ve, dns1.corselca.gob.ve"
senafim.gob.ve,2021-11-19,2021,2031-11-19,2021-11-19,NIC-VE,Oficina Nacional De Fiscalización E Inspección Minera,1060,VE,"ns2.senafim.gob.ve, ns1.senafim.gob.ve"
mppe.gob.ve,2021-11-05,2021,2031-11-05,2024-11-07,NIC-VE,Ministerio Del Poder Popular Para La Educacion,1010,VE,"dns2.cantv.net, dns1.cantv.net"
emprenderjuntos.gob.ve,2021-10-18,2021,2031-10-18,2021-10-18,NIC-VE,Ministerio Del Poder Popular De Econom  A Y Finanzas,1010,VE,"dns2.mppef.gob.ve, dns1.mppef.gob.ve"
polocientifico.gob.ve,2021-10-13,2021,2031-10-13,2023-05-03,NIC-VE,,Caracas,VE,"ns4.reacciun.ve, ns3.reacciun.ve"
cmao.gob.ve,2021-09-27,2021,2031-09-27,2021-09-27,NIC-VE,Concejo Municipal Angostura Del Orinoco,8001,VE,"ns2.cmao.gob.ve, ns1.cmao.gob.ve"
futurafm.gob.ve,2021-09-20,2021,2031-09-20,2021-09-20,NIC-VE,Futura,4013,VE,"b11.dns40.com, b10.dns40.com"
tubhelca.gob.ve,2021-09-15,2021,2031-09-15,2021-09-15,NIC-VE,Tuberias Helicoidales  C A,3001,VE,"sara.ns.cloudflare.com, elmo.ns.cloudflare.com"
flnh.gob.ve,2021-07-30,2021,2031-07-30,2021-07-30,NIC-VE,Fundacion Laboratorio Nacional De Hidraulica,1073,VE,"ns351.gconex.com, ns350.gconex.com"
solucioneshidraulicas.gob.ve,2021-07-30,2021,2031-07-30,2021-07-30,NIC-VE,Fundacion Laboratorio Nacional De Hidraulica,1073,VE,"ns351.gconex.com, ns350.gconex.com"
observatorio.gob.ve,2021-06-17,2021,2031-06-17,2021-06-17,NIC-VE,Centro Internacional De Inversi  N Productiva,1064,VE,"ns2.observatorio.gob.ve, ns1.observatorio.gob.ve"
sunad.gob.ve,2021-06-16,2021,2031-06-16,2021-06-16,NIC-VE,Oficina Nacional Antidrogas,1010,VE,"dns2.sunad.gob.ve, dns1.sunad.gob.ve"
elpuebloparticipa.gob.ve,2021-04-09,2021,2031-04-09,2021-04-09,NIC-VE,Fondo Nacional De Misiones,1060,VE,"aarav.ns.cloudflare.com, jen.ns.cloudflare.com"
regresoaclases.gob.ve,2021-03-19,2021,2031-03-19,2021-03-19,NIC-VE,Fondo Nacional De Misiones,1060,VE,"jen.ns.cloudflare.com, aarav.ns.cloudflare.com"
sna.gob.ve,2021-03-12,2021,2031-03-12,2021-03-12,NIC-VE,Oficina Nacional Antidrogas,1010,VE,"dns2.sna.gob.ve, dns1.sna.gob.ve"
hidrocapital.gob.ve,2021-02-09,2021,2031-02-09,2021-02-09,NIC-VE,NO APLICA,1050,VE,"ns2.hidrocapital.gob.ve, ns1.hidrocapital.gob.ve"
alcaldiadesanfelipe.gob.ve,2021-01-29,2021,2031-01-29,,NIC-VE,Alcaldia Del Mcpio San Felipe Edo.yaracuy,3201,VE,"ns29.tepuyserver.net, ns30.tepuyserver.net"
fonaguas.gob.ve,2021-01-07,2021,2031-01-07,2025-12-12,NIC-VE,Fondo Nacional Para La Gestion Integral De Las Aguas,1010,VE,"dns3004a.trouble-free.net, dns3004b.trouble-free.net"
alcaldiabaruta.gob.ve,2020-11-13,2020,2030-11-13,,NIC-VE,,1080,VE,"dns.site5.com, dns2.site5.com"
cenaoz.gob.ve,2020-10-23,2020,2030-10-23,2025-12-29,NIC-VE,,1010,VE,"ns2.cenaoz.gob.ve, ns1.cenaoz.gob.ve"
sedatez.gob.ve,2020-07-14,2020,2030-07-14,,NIC-VE,,4001,VE,"ns2.sedatez.gob.ve, ns1.sedatez.gob.ve"
sedematlagunillas.gob.ve,2020-07-03,2020,2030-07-03,,NIC-VE,,1010,VE,"ns1.a2hosting.com, ns2.a2hosting.com, ns3.a2hosting.com, ns4.a2hosting.com"
fundacite.gob.ve,2020-06-18,2020,2030-06-18,,NIC-VE,Ministerio Del Poder Popular Para Ciencia Y Tecnologia,1010,VE,"ns1.mppct.gob.ve, ns2.mppct.gob.ve"
araguena.gob.ve,2020-05-15,2020,2030-05-15,,NIC-VE,NO APLICA,2103,VE,"ns7.conectarhosting.com, ns8.conectarhosting.com"
jirajara.gob.ve,2020-04-11,2020,2030-04-11,2022-02-22,NIC-VE,Complejo Alfarero Jirajara Ca,4101,VE,"ns2.dattaapure.com, ns1.dattaapure.com"
petrocasa.gob.ve,2020-04-11,2020,2030-04-11,,NIC-VE,Petrocasa S.a.,2013,VE,"ns5.conectarhosting.com, ns6.conectarhosting.com"
gaslara.gob.ve,2020-03-27,2020,2030-03-27,2020-04-20,NIC-VE,GASLARA,3001,VE,"jason.ns.cloudflare.com, lara.ns.cloudflare.com"
sedat.gob.ve,2020-03-27,2020,2030-03-27,2024-04-22,NIC-VE,Servicio Desconcentrado De Administraci  N Tributaria Del Municipio Sucre,1071,VE,"june.ns.cloudflare.com, gerardo.ns.cloudflare.com"
lecheria.gob.ve,2020-02-11,2020,2030-02-11,,NIC-VE,Alcaldia del Municipio Turistico El Morro Lcdo. Diego Bautista Urbaneja,6016,VE,"matrix2.adclichosting.com, matrix1.adclichosting.com"
inidi.gob.ve,2020-02-06,2020,2030-02-06,2025-05-21,NIC-VE,Instituto Nacional De Idiomas Indigenas,1010,VE,"ns2.byet.org, ns1.byet.org"
xvcenso.gob.ve,2019-10-08,2019,2030-10-08,2022-09-22,NIC-VE,,Caracas,VE,"ns1.mppp.gob.ve, ns2.mppp.gob.ve"
mincyt.gob.ve,2019-09-25,2019,2029-09-25,2025-12-12,NIC-VE,Ministerio del Poder Popular para la Ciencia y Tecnología,1010,VE,"ns2.mppct.gob.ve, ns5.nube.gob.ve, ns3.nube.gob.ve, ns1.mppct.gob.ve"
mppct.gob.ve,2019-08-21,2019,2029-08-21,2025-12-12,NIC-VE,Ministerio Del Poder Popular Para Ciencia Y Tecnologia,1010,VE,"ns1.mppct.gob.ve, ns2.mppct.gob.ve"
prensapresidencialvenezuela.gob.ve,2019-08-16,2019,2029-08-16,2024-06-13,NIC-VE,Ministerio Del Poder Popular Del Despacho De La Presidencia Y Seguimiento De La Gestion De Gobierno,1010,VE,"ns2.digalo.gob.ve, ns1.digalo.gob.ve"
mincomercionacional.gob.ve,2019-05-10,2019,2029-12-31,,NIC-VE,,Caracas,VE,"dns1.cantv.net, dns2.cantv.net"
funvi.gob.ve,2019-03-20,2019,2029-12-31,2023-10-26,NIC-VE,Fundaci  N Vivienda Del Distrito Capital,1020,VE,"dns2.cantv.net, dns1.cantv.net"
vensalud.gob.ve,2019-02-18,2019,2029-12-31,2024-11-20,NIC-VE,Venezolana De Servicios Tecnologicos Para Equipos De Salud S A,1010,VE,"ns1.vensalud.gob.ve, ns2.vensalud.gob.ve"
alcaldiacaroni.gob.ve,2019-01-18,2019,2029-12-31,2019-10-09,NIC-VE,,San Felix,VE,"dns2.cant.net, dns1.cantv.net, ns1.alcaldiacaroni.gob.ve"
corposaludyaracuy.gob.ve,2018-12-14,2018,2029-12-31,,NIC-VE,,San Felipe,VE,"kay.ns.cloudflare.com, theo.ns.cloudflare.com"
corpoez.gob.ve,2018-11-19,2018,2029-12-31,2021-04-30,NIC-VE,Corporacion Ecosocialista Ezequiel Zamora  S A   Corpoez,1071,VE,"ns1.corpoez.gob.ve, ns2.corpoez.gob.ve"
minaguas.gob.ve,2018-10-10,2018,2029-12-31,,NIC-VE,Rodulfo Oswaldo,1010,VE,"ns1.minaguas.gob.ve, ns2.minaguas.gob.ve"
sunacrip.gob.ve,2018-07-28,2018,2029-12-31,,NIC-VE,,Caracas,VE,"ns1.sunacrip.gob.ve, ns2.sunacrip.gob.ve, ns3.sunacrip.gob.ve, ns4.sunacrip.gob.ve"
iaefalcon.gob.ve,2018-07-13,2018,2029-12-31,,NIC-VE,,Santa Ana de Coro,VE,"kay.ns.cloudflare.com, theo.ns.cloudflare.com"
minpesca.gob.ve,2018-06-28,2018,2029-12-31,2025-11-04,NIC-VE,Ministerio Del Poder Popular De Pesca Y Acuicultura,1010,VE,"dns1.minpesca.gob.ve, dns2.minpesca.gob.ve"
chambajuvenil.gob.ve,2018-06-26,2018,2029-12-31,,NIC-VE,,Caracas,VE,"dns2.gmsaberytrabajo.gob.ve, externo1.gmsaberytrabajo.gob.ve"
alcaldiademiranda.gob.ve,2018-05-24,2018,2029-12-31,,NIC-VE,NO APLICA,2041,VE,"iris.ns.cloudflare.com, ethan.ns.cloudflare.com"
sudeca.gob.ve,2018-05-16,2018,2029-12-31,,NIC-VE,,Caracas,VE,"dns1.sudeca.gob.ve, dns2.sudeca.gob.ve"
icopetro.gob.ve,2018-04-10,2018,2029-12-31,,NIC-VE,,Caracas,VE,"luke.ns.cloudflare.com, mona.ns.cloudflare.com"
minagricultura.gob.ve,2018-02-22,2018,2029-12-31,,NIC-VE,,Caracas,VE,"ns1.minagricultura.gob.ve, ns2.minagricultura.gob.ve"
ont.gob.ve,2018-02-22,2018,2029-12-31,,NIC-VE,,caracas,VE,"dns1.mppef.gob.ve, dns2.mppef.gob.ve"
petro.gob.ve,2018-01-31,2018,2029-12-31,,NIC-VE,,Caracas,VE,"ns1.petro.gob.ve, ns4.petro.gob.ve, ns3.petro.gob.ve, ns2.petro.gob.ve"
maracaibo.gob.ve,2018-01-29,2018,2029-12-31,,NIC-VE,,Maracaibo,VE,"ns1.afraid.org, ns2.afraid.org, ns3.afraid.org, ns4.afraid.org"
envial.gob.ve,2018-01-24,2018,2029-12-31,,NIC-VE,,Caracas,VE,"west.ns.cloudflare.com, molly.ns.cloudflare.com"
ispeb.gob.ve,2018-01-15,2018,2029-12-31,2025-05-21,NIC-VE,Instituto De Salud Publica Del Edo Bolivar,8001,VE,"sam.ns.cloudflare.com, daphne.ns.cloudflare.com"
planpatria.gob.ve,2018-01-05,2018,2029-12-31,2022-09-22,NIC-VE,,Caracas,VE,"ns1.mppp.gob.ve, ns2.mppp.gob.ve"
minpet.gob.ve,2017-12-22,2017,2029-12-31,,NIC-VE,,Caracas,VE,"dns1.cantv.net, dns2.cantv.net"
cmcarvajal.gob.ve,2017-12-13,2017,2029-12-31,,NIC-VE,,Trujillo,VE,"ns1.cdmon.net, ns2.cdmon.net, ns3.cdmon.net"
blockchain.gob.ve,2017-12-07,2017,2029-12-31,,NIC-VE,,Caracas,VE,"ns3.reacciun.ve, ns4.reacciun.ve"
cneh.gob.ve,2017-11-29,2017,2029-12-31,2025-06-27,NIC-VE,Fundacion Centro Nacional De Estudios Historicos,1010,VE,ns1.cneh.gob.ve
insemat.gob.ve,2017-11-23,2017,2029-12-31,,NIC-VE,Instituto Autonomo De Servicio Municipal De Administración Tributaria,3050,VE,"ns-cloud-a4.googledomains.com, ns-cloud-a3.googledomains.com, ns-cloud-a2.googledomains.com, ns-cloud-a1.googledomains.com"
corposervica.gob.ve,2017-10-31,2017,2029-12-31,2024-05-29,NIC-VE,Corporacion De Servicios De Vigilancia Y Seguridad  S A,1080,VE,"ns11.wnetserver.com, ns12.wnetserver.com"
agrosur.gob.ve,2017-10-19,2017,2029-12-31,2020-04-02,NIC-VE,Conglomerado Agrosur S.A,1012,VE,"bryce.ns.cloudflare.com, vita.ns.cloudflare.com"
unif.gob.ve,2017-10-11,2017,2029-12-31,2019-08-15,NIC-VE,,Caracas,VE,"dns1.unif.gob.ve, dns2.unif.gob.ve"
apn.gob.ve,2017-09-25,2017,2029-12-31,,NIC-VE,,Caracas,VE,"ns2.mppp.gob.ve, ns1.mppp.gob.ve"
billeteramovil.gob.ve,2017-09-12,2017,2029-12-31,,NIC-VE,,caracas,VE,"dns1.cantv.net, dns2.cantv.net"
oncdoft.gob.ve,2017-04-21,2017,2029-12-31,2025-08-04,NIC-VE,Oficina Nacional Contra La Delincuencia Organizada Y Financiamiento Al Terrorismo,1060,VE,"ns2.oncdoft.gob.ve, ns1.oncdoft.gob.ve"
desarrollominero.gob.ve,2017-03-11,2017,2029-12-31,2022-09-16,NIC-VE,Ministerio Del Poder Popular De Desarrollo Minero Ecol  Gico,1060,VE,"ns3.mppdme.gob.ve, ns4.mppdme.gob.ve"
ivpa.gob.ve,2017-02-21,2017,2029-12-31,,NIC-VE,,Caracas,VE,"ns2.mppp.gob.ve, ns1.mppp.gob.ve"
mppop.gob.ve,2017-02-20,2017,2029-12-31,2023-05-19,NIC-VE,Ministerio Del Poder Popular De Obras Publicas,1050,VE,"dns2.mppop.gob.ve, dns1.mppop.gob.ve"
mppt.gob.ve,2017-02-20,2017,2029-12-31,,NIC-VE,,Caracas,VE,"dns1.mppt.gob.ve, dns2.mppt.gob.ve"
cuspal.gob.ve,2017-02-03,2017,2029-12-31,,NIC-VE,,Caracas,VE,"ns2.cuspal.gob.ve, ns1.cuspal.gob.ve"
polimara.gob.ve,2017-02-03,2017,2029-12-31,,NIC-VE,,San Rafael de El Mojan,VE,"ns1.hostingmaracaibo.com, ns2.hostingmaracaibo.com"
ucs.gob.ve,2016-12-08,2016,2029-12-31,,NIC-VE,,Caracas,VE,"dns1.cantv.net, dns2.cantv.net"
juventudydeporte.gob.ve,2016-10-05,2016,2029-12-31,2023-08-21,NIC-VE,Ministerio Del Poder Popular Para La Juventud Y El Deporte,1020,VE,"dns2.cantv.net, dns1.cantv.net"
softwarepublico.gob.ve,2016-08-22,2016,2029-12-31,,NIC-VE,,Caracas,VE,"ns3.reacciun.ve, ns4.reacciun.ve"
sarep.gob.ve,2016-08-02,2016,2029-12-31,,NIC-VE,,Guanare,VE,"ns1.hostingmaracaibo.com, ns2.hostingmaracaibo.com"
contraloriamunicipaldeheres-bolivar.gob.ve,2016-06-16,2016,2029-12-31,,NIC-VE,,Ciudad Bolivar,VE,"dns1.alcaldiadeheres.gob.ve, dns2.alcaldiadeheres.gob.ve"
avp.gob.ve,2016-06-03,2016,2029-12-31,,NIC-VE,,Caracas,VE,"ns1.8ssi.com, ns2.8ssi.com"
fnp.gob.ve,2016-04-08,2016,2029-12-31,,NIC-VE,,Caracas,VE,"ns2.digalo.gob.ve, ns1.digalo.gob.ve"
bustaguanes.gob.ve,2016-03-11,2016,2029-12-31,,NIC-VE,,San Carlos,VE,"kai.ns.cloudflare.com, sandy.ns.cloudflare.com"
circuitorrb.gob.ve,2016-03-10,2016,2029-12-31,,NIC-VE,Ejecutivo Del Estado Bolivar,8001,VE,"dns2.caracashosting25.com, dns1.caracashosting25.com"
minppau.gob.ve,2016-01-29,2016,2029-12-31,,NIC-VE,,Caracas,VE,"ns1.minppau.gob.ve, ns2.minppau.gob.ve"
vpse.gob.ve,2016-01-29,2016,2029-12-31,,NIC-VE,,Caracas,VE,"ns2.industrias.gob.ve, ns1.industrias.gob.ve"
huc.gob.ve,2015-12-14,2015,2029-12-31,2024-08-29,NIC-VE,Instituto Autonomo Hospital Universitario De Caracas,1041,VE,"dns2.huc.gob.ve, dns1.huc.gob.ve"
cenvih.gob.ve,2015-11-05,2015,2029-12-31,2025-11-10,NIC-VE,Cenvih,1080,VE,"ns2.mppct.gob.ve, ns1.mppct.gob.ve, ns3.mppct.gob.ve"
hidroandes.gob.ve,2015-10-19,2015,2029-12-31,,NIC-VE,,Barinas,VE,"ns8.globalhostla.com, ns7.globalhostla.com"
alcaldiamunicipiolibertador-mer.gob.ve,2015-09-18,2015,2029-12-31,,NIC-VE,,Merida,VE,"ns25.tepuyserver.net, ns26.tepuyserver.net"
turmero.gob.ve,2015-09-17,2015,2029-12-31,,NIC-VE,,Turmero,VE,ns1.turmero.gob.ve
utne.gob.ve,2015-07-23,2015,2029-12-31,,NIC-VE,,Porlamar,VE,"ns3.reacciun.ve, ns4.reacciun.ve"
antimonopolio.gob.ve,2015-07-16,2015,2029-12-31,2022-05-26,NIC-VE,Superintendencia Antimonopolio,1015,VE,"dns2.cantv.net, dns1.cantv.net"
sinco.gob.ve,2015-07-03,2015,2029-12-31,2020-03-06,NIC-VE,,Caracas,VE,"ns2.sinco.gob.ve, ns1.sinco.gob.ve"
almccs.gob.ve,2015-06-11,2015,2029-12-31,,NIC-VE,,Caracas,VE,"ns1.dattaapure.com, ns2.dattaapure.com"
minhvi.gob.ve,2015-05-28,2015,2029-12-31,,NIC-VE,,Caracas,VE,"ns1.afraid.org, ns1.minhvi.gob.ve, ns2.afraid.org, ns2.minhvi.gob.ve"
corposaludaragua.gob.ve,2015-03-31,2015,2029-12-31,,NIC-VE,,Maracay,VE,"dns1.corposaludaragua.gob.ve, dns2.corposaludaragua.gob.ve"
sunagro.gob.ve,2015-03-17,2015,2029-12-31,,NIC-VE,,Caracas,VE,"dns1.sunagro.gob.ve, dns2.sunagro.gob.ve"
hcudamp.gob.ve,2015-03-11,2015,2029-12-31,,NIC-VE,,Barquisimeto,VE,"ns1.he.net, ns2.he.net, ns3.he.net, ns4.he.net, ns5.he.net"
samath.gob.ve,2015-03-05,2015,2029-12-31,,NIC-VE,,Bolivar,VE,"dns1.alcaldiadeheres.gob.ve, dns2.alcaldiadeheres.gob.ve"
alcaldiadeplaza.gob.ve,2015-01-21,2015,2029-12-31,2021-11-03,NIC-VE,Alcaldia Del Municipio Plaza,1220,VE,"ns2.dns-parking.com, ns1.dns-parking.com"
ven911.gob.ve,2014-11-07,2014,2029-12-31,,NIC-VE,,Caracas,VE,"dns2.cantv.net, dns1.cantv.net"
safonapp.gob.ve,2014-10-29,2014,2029-12-31,2022-08-25,NIC-VE,Servicio Fondo Nacional Del Poder Popular,1010,VE,"ns2.safonapp.gob.ve, ns1.safonapp.gob.ve"
alcaldiadeindependencia.gob.ve,2014-09-23,2014,2029-12-31,,NIC-VE,NO APLICA,3221,VE,"kira.ns.cloudflare.com, ethan.ns.cloudflare.com"
fundavene.gob.ve,2014-09-22,2014,2029-12-31,2023-05-11,NIC-VE,Fundaci  N Venezolana De Donaciones Y Trasplantes De   Rganos  Tejidos Y C  Lulas  Fundavene,1010,VE,"ns2.nube.gob.ve, ns1.nube.gob.ve"
consejoderechoshumanos.gob.ve,2014-09-03,2014,2029-12-31,,NIC-VE,Vladimir Jesus,1011,VE,"emma.ns.cloudflare.com, west.ns.cloudflare.com"
gmsaberytrabajo.gob.ve,2014-09-03,2014,2029-12-31,,NIC-VE,,Caracas,VE,"dns2.gmsaberytrabajo.gob.ve, externo1.gmsaberytrabajo.gob.ve"
espromedbio.gob.ve,2014-08-14,2014,2029-12-31,,NIC-VE,,Caracas,VE,"dns2.espromedbio.gob.ve, dns1.espromedbio.gob.ve"
concejomunicipalelhatillo.gob.ve,2014-07-23,2014,2029-12-31,2023-10-03,NIC-VE,Concejo Municipal El Hatillo,1083,VE,"nspro33.hostgator.mx, nspro32.hostgator.mx"
conati.gob.ve,2014-07-07,2014,2029-12-31,2025-12-02,NIC-VE,Comisi  N Nacional De Las Tecnologias De Informaci  N,1010,VE,"ns2.mppct.gob.ve, ns1.mppct.gob.ve, ns3.mppct.gob.ve"
concejomunicipalplaza.gob.ve,2014-06-19,2014,2029-12-31,,NIC-VE,,Guarenas,VE,"ns3.netquatro.net, ns4.netquatro.net"
hogaresdelapatria.gob.ve,2014-06-11,2014,2029-12-31,2023-03-23,NIC-VE,Fundacion Gran Mision Hogares De La Patria,1010,VE,"dns2.hogaresdelapatria.gob.ve, dns1.hogaresdelapatria.gob.ve"
contraloriaautonomadeguacara.gob.ve,2014-06-02,2014,2029-12-31,,NIC-VE,,Guacara,VE,"ns2.wnetserver.com, ns1.wnetserver.com"
mpppst.gob.ve,2014-05-28,2014,2029-12-31,,NIC-VE,,Caracas,VE,"dns1.mpppst.gob.ve, dns2.mpppst.gob.ve"
contraloriarosariodeperija.gob.ve,2014-05-13,2014,2029-12-31,,NIC-VE,,Villa del Rosario,VE,"ns11.8ssi.com, ns12.8ssi.com, ns1.8ssi.com, ns2.8ssi.com"
alcaldiadeatures.gob.ve,2014-05-05,2014,2029-12-31,,NIC-VE,,Puerto Ayacucho,VE,"da2.dns40.com, da1.dns40.com"
concejomunicipalacevedo.gob.ve,2014-04-11,2014,2029-12-31,,NIC-VE,,Caucagua,VE,"ns4.netquatro.net, ns3.netquatro.net"
alcaldiadenirgua.gob.ve,2014-03-11,2014,2029-12-31,,NIC-VE,,Nirgua,VE,"ns1.8ssi.com, ns2.8ssi.com"
sundde.gob.ve,2014-02-12,2014,2029-12-31,,NIC-VE,,caracas,VE,"dns1.cantv.net, dns2.cantv.net"
corpovex.gob.ve,2013-12-11,2013,2029-12-31,,NIC-VE,Corporación Venezolana De Comercio Exterior S.a.,1052,VE,"ns1.corpovex.gob.ve, ns2.corpovex.gob.ve"
edosucre.gob.ve,2013-11-25,2013,2029-12-31,2020-05-15,NIC-VE,,6101,VE,"ns2.daycohost.com, ns1.daycohost.com"
cesppa.gob.ve,2013-11-15,2013,2029-12-31,2025-07-23,NIC-VE,Centro Estrategico De Seguridad Y Proteccion De La Patria,1010,VE,"ns2.cesppa.gob.ve, ns4.cesppa.gob.ve"
resquimc.gob.ve,2013-10-01,2013,2029-12-31,2021-07-27,NIC-VE,Registro Nacional Unico De Operadores De Sustancias Quimicas Controladas  Resquimc,1014,VE,"dns2.cantv.net, dns1.cantv.net"
satdc.gob.ve,2013-09-23,2013,2029-12-31,2019-11-14,NIC-VE,Servicio de Administracion Tributaria del Distrito Capital,1010,VE,"ns4.tepuyserver.net, ns3.tepuyserver.net"
contraloriadelmunicipioacevedo.gob.ve,2013-09-18,2013,2029-12-31,,NIC-VE,,Caucagua,VE,"ns3.netquatro.net, ns4.netquatro.net"
